{
  "version": 1,
  "initialized_at": "2026-08-07T00:00:00.000Z",
  "framework_home": null,
  "capabilities": {
    "package_manager": { "present": true, "evidence": ["pnpm-lock.yaml"] },
    "frontend": { "present": true, "evidence": ["apps/web/package.json#react"] },
    "lint": { "present": true, "evidence": ["eslint.config.js"] },
    "format": { "present": true, "evidence": [".prettierrc"] },
    "unit-tests": { "present": true, "evidence": ["package.json#vitest"] },
    "e2e-tests": { "present": false, "evidence": [] },
    "ci": { "present": true, "evidence": [".github/workflows"] },
    "monorepo": { "present": true, "evidence": ["pnpm-workspace.yaml", "turbo.json"] },
    "backend-source": { "present": true, "evidence": ["apps/api/package.json#@nestjs/core"] },
    "api-client-only": { "present": false, "evidence": [] },
    "design-system": { "present": true, "evidence": ["packages/ui"] },
    "auth": { "present": true, "evidence": ["apps/api"] },
    "build": { "present": true, "evidence": ["turbo.json"] },
    "typecheck": { "present": true, "evidence": ["tsconfig.json"] }
  },
  "archetype": "monorepo",
  "active_run": null
}
