{
  "version": 1,
  "initialized_at": "2026-08-07T00:00:00.000Z",
  "framework_home": "/Users/alpesh/Desktop/Projects/engineering-os",
  "capabilities": {
    "package_manager": {
      "present": false,
      "evidence": []
    },
    "lint": {
      "present": false,
      "evidence": []
    },
    "format": {
      "present": false,
      "evidence": []
    },
    "unit-tests": {
      "present": false,
      "evidence": []
    },
    "e2e-tests": {
      "present": false,
      "evidence": []
    },
    "ci": {
      "present": false,
      "evidence": []
    },
    "monorepo": {
      "present": false,
      "evidence": []
    },
    "backend-source": {
      "present": false,
      "evidence": []
    },
    "frontend": {
      "present": false,
      "evidence": []
    },
    "api-client-only": {
      "present": false,
      "evidence": []
    },
    "design-system": {
      "present": true,
      "evidence": [
        "src/components/ui"
      ]
    },
    "auth": {
      "present": false,
      "evidence": []
    },
    "build": {
      "present": false,
      "evidence": []
    },
    "typecheck": {
      "present": false,
      "evidence": []
    }
  },
  "archetype": "unknown",
  "active_run": {
    "id": "feature-development-2026-08-12T09-24-53-478Z",
    "workflow_id": "feature-development",
    "current_phase": "approve",
    "phase_index": 4,
    "started_at": "2026-08-12T09:24:53.481Z",
    "artifacts_dir": "/Users/alpesh/Desktop/Projects/engineering-os/examples/frontend-spa/.engineering-os/artifacts/feature-development-2026-08-12T09-24-53-478Z",
    "completed_phases": [],
    "gates": {
      "plan-approval": {
        "status": "pending",
        "updated_at": "2026-08-12T09:24:53.489Z",
        "note": ""
      },
      "contract-approval": {
        "status": "pending",
        "updated_at": "2026-08-12T09:24:53.489Z",
        "note": ""
      }
    },
    "flags": {
      "architectural_impact": false
    },
    "status": "active",
    "orchestration": {
      "pipeline": "pre-approval",
      "completed_steps": [
        "preflight",
        "jira_discovery",
        "figma_discovery",
        "feature_contract",
        "plan_intelligence",
        "plan_bundle_validate"
      ],
      "blockers": [],
      "last_error": null
    },
    "blocked": false
  },
  "feature_intake": {
    "jira": {
      "key": "TEST-1",
      "source": "key",
      "raw": "TEST-1"
    },
    "figma": null,
    "context": "CSV export demo",
    "parsed_at": "2026-08-12T09:24:53.473Z"
  }
}
